{
  "schema_version": 1,
  "issuer": "license-guard",
  "license_id": "LIC-TEST-0001",
  "customer_id": "customer-demo",
  "product": "worker-suite",
  "installation_id": "11111111-1111-4111-8111-111111111111",
  "installation_public_key_sha256": "c945cbf2a5602002141e2fb9d17054d6ca069951df73f49d1f8aca87f9878f60",
  "sequence": 1,
  "issued_at": 1800144000,
  "not_before": 1800143880,
  "lease_valid_until": 1800748800,
  "entitlement_expires_at": 1831680000,
  "mode": "renewable",
  "features": [
    "messaging",
    "transcoding"
  ],
  "binding": {
    "policy": "linux-host-v1",
    "machine_id_hash": "daf818a6d9b99acfc1f085f5e035163eb1e29c051e65a17c38d694bf6e92c84c",
    "system_uuid_hash": "d4f98b0cc6966610efccf807a0c658cb679392dcd89b5fd788c8d813d64b71fb"
  },
  "max_logical_processors": null
}
